id,applicant_email,created_at,status,claimed_by,claimed_at,age,gender,github,linkedin,ethnicity,resumeLink,tshirtSize,yearOfStudy,proudProject,lastNameLegal,portfolioLink,preferredName,firstNameLegal,chooseOneAnswer,institutionName,summerHacksGoal,accessibilityNeeds,dietaryRestrictions,travelToDowntownToronto,year,offlineSelf,rambleTopic,bearOrMuffin,travelToToronto
3f27a536-0c63-402f-95e1-5f48805c740d,krish.bhoopati556@gmail.com,2026-06-02 04:01:53.888526+00,in_review,rev_itutaclqt,2026-06-16 21:23:30.422195+00,19,Male,https://github.com/krishbhoopati,https://www.linkedin.com/in/krish-bhoopati/,Asian,https://drive.google.com/file/d/1L7IS1VrtYkikYF7XyaixaTiATV-DdD2n/view?usp=sharing,L,,"One project I’m really proud of is AURA, a hackathon project my team built after completely pivoting halfway through the event.

The hackathon ran from Friday night to Sunday afternoon, and our original plan did not go the way we expected. We spent most of Friday brainstorming and building around an idea, but by midnight, we realized it was not strong enough. Instead of forcing it, we decided to scrap everything and start over. That was definitely stressful because we had already lost a lot of time, and in a hackathon, every hour matters.

By around noon the next day, we landed on AURA: a product designed to help people better understand and manage their personal presence, communication, and confidence. My role was mainly on the product and business side. I helped shape the problem, define the user experience, decide which features actually mattered, and make sure our final pitch clearly explained why AURA was useful and different. I also helped keep the team focused when we had very little time left.

One of the biggest challenges was building under pressure while also staying realistic. After pivoting, we had under 24 hours to create something polished enough to demo. To make it harder, one of our teammates had to leave, so we were suddenly working with a smaller team. We had to cut features, prioritize the core experience, and focus on telling a clear story instead of trying to build everything.

That experience taught me a lot about execution. A good idea is important, but the ability to adapt quickly matters even more. We could have stuck with our original idea because we had already invested time into it, but being honest that it was not working gave us a much better outcome.

In the end, AURA won two tracks, which made the experience even more rewarding. I was proud because it showed that our team could stay calm, make hard decisions, and still build something strong under pressure. More than anything, it reminded me that constraints can actually lead to better creativity when a team is willing to move fast and trust each other.
",Bhoopati,https://portfolio-one-rust-z95h4v5n4u.vercel.app/,Krish,Krish,"I would define creativity today as the ability to take ideas, tools, experiences, and perspectives, then combine them into something meaningful. Creativity is no longer just about who can draw the best, code the fastest, or produce something completely alone. It is about having a unique point of view and using whatever tools are available to bring that point of view to life.

Because of that, I do not think generative AI diminishes the value of human art or creativity. I think it changes where the value comes from. AI can generate text, images, music, code, and designs very quickly, but it still needs direction. The human is the one deciding what is worth making, what emotion it should carry, what problem it should solve, and what final version feels right.

To me, AI is similar to previous creative tools. Cameras did not destroy painting. Photoshop did not destroy photography. Canva did not destroy design. These tools changed the process and made creation more accessible, but they did not remove the need for taste, judgment, and originality. In the same way, AI gives more people the ability to express ideas they may not have had the technical skills to create before.

I have seen this in my own projects. At hackathons, AI can help generate code, brainstorm features, write copy, or speed up research. But it does not replace the hard parts: deciding what problem matters, understanding the user, making trade-offs, and building something people actually care about. Those parts still require human creativity.

I also think AI may make human creativity more valuable in some ways. As more AI-generated content appears online, people will care even more about authenticity, story, and intention. A technically perfect image or paragraph is not always meaningful. What makes something memorable is often the human reason behind it.",Wilfrid Laurier University,"More than anything, I want to meet people who are obsessed with building cool things.

Some of my favorite experiences have come from hackathons because they bring together people with completely different backgrounds who all share the same goal: creating something meaningful in a short amount of time. I love the energy that comes from turning an idea into a real product over a weekend.

I’m also excited to learn from people who think differently than I do. Whether that’s a designer, developer, founder, or someone attending their first hackathon, I always leave these events with new perspectives and skills.

Of course, I want to build something I'm proud of, but I think the best part of hackathons is everything that happens around the project. The conversations, friendships, lessons, and unexpected opportunities often end up being just as valuable as the final product itself.",N/A,N/A,Yes,2028,"Outside of tech, I am someone who enjoys spending time with people and trying new things. I play badminton regularly, enjoy exploring new food spots, and am usually down for anything spontaneous. A lot of my free time is spent hanging out with friends, going to events, or just having long conversations about random topics. I am naturally curious, so I tend to pick up different interests all the time. One month it might be learning about startups, the next it could be a new sport or hobby. While I enjoy building products and working on projects, most people who know me would probably describe me as someone who likes bringing people together, meeting new people, and making the most out of every opportunity.","I could talk for hours about failed startups.

Most people love hearing stories about billion-dollar companies, but I find the companies that failed much more interesting. There are thousands of startups that raised money, hired talented teams, built great products, and still didn't make it.

I love digging into why. Was it bad timing? Did they solve the wrong problem? Did they have a great product but no distribution? Sometimes the difference between success and failure comes down to a tiny decision that seemed insignificant at the time.

As a venture scout and someone who enjoys entrepreneurship, I spend way too much time reading founder interviews, investment memos, and startup postmortems. It's like solving a giant puzzle where you're trying to figure out what actually matters when building a company.","I would fight the bear with sharks for arms. I know I probably would not win, but at least the problem is clear. The muffin and baby situation would make everyday life impossible. Every trip to a bakery, grocery store, or birthday party would become a stressful experience. Imagine having to ask people if the muffin you are holding is actually a muffin. That is not a risk I am willing to take. The bear, on the other hand, is just one very bad day. If I survive, I get an incredible story. If I do not, at least I do not have to spend the rest of my life being confused by baked goods. So while fighting a shark-armed bear sounds terrible, it is still the easier choice.",
42023821-34b2-4511-ada5-22e22812c619,athite@uwaterloo.ca,2026-06-16 20:25:28.656557+00,pending,,,18,Male,https://github.com/EleKtr1X,https://www.linkedin.com/in/aarnavthite,Asian,https://elektr1x.github.io/RESUME.pdf,M,Second,"This is a project I am still currently working on with another developer.

Algorithms are absolutely everywhere, and it's easy to fall under their grasp. Hours can go by doomscrolling on Instagram Reels, YouTube Shorts, TikTok, etc., and it's really affecting me and a lot of my friends too. A lot of us have installed Beeper and similar apps to get rid of the reels on Instagram while still keeping messages, but it denies us access to the content we want to engage with and this doesn't solve the issue with YouTube. 

To combat this, I've come up with Qration, which is my take on RSS. RSS was the biggest way people on the internet could subscribe to various sources and get exactly what they want all the time until Google killed off their reader in the mid-2010s. Not many people my age know what RSS even was, and a lot of the readers that still exist today are obsolete, only for super technical users or clunky. Qration is targeted towards a general audience. You put in a link to a YouTube channel, a BlueSky account, some RSS feeds you want to subscribe to, and it just works. It's your feed, your rules, 100% free and 100% open source. It even works offline!

Some challenges I faced while making this was actually figuring out how we would go about this. The original idea was pretty much just an RSS reader but with a discovery page added to it. Then, we started thinking about how we would use it and what the best user experience would be. Taking inspiration from apps like Beeper and Grayjay, we came up with this idea. We pivoted a lot of times between when we started and today, and that is a lesson I've learned. Good ideas don't just come in a vacuum.",Thite,https://elektr1x.github.io,,Aarnav,"I'll answer #2. Outside of tech, I am a producer and now DJ. I mostly make EDM music and my biggest inspirations are French house musicians like Daft Punk and Modjo. I picked up DJing last September and I've been going at it pretty strong! No gig yet unfortunately, but I will get one soon.",University of Waterloo,"An ideal time at SummerHacks would be not one where I'd necessarily win or get any prizes, but one where I meet new people, learn about new technologies and concepts, pitch well to judges well and create a project that I am very proud of that I can maybe even continue working on in the future. It's the journey rather than the destination that would make this an ideal experience.",No,No beef,Yes,,,,,
425d8726-31a9-4fbb-8665-df3ee91405d5,k79gupta@uwaterloo.ca,2026-06-08 02:12:53.802631+00,pending,,,18,Male,https://github.com/Karan-Gupta07,https://www.linkedin.com/in/karan-gupta-2b72a735a,Asian,https://drive.google.com/file/d/1RwYOd0Nr5XMzKiuCA8r9z1tinLYsYE-Q/view?usp=drivesdk,L,First,"At a recent hackathon, my team and I set out to tackle a massive environmental and consumer issue: the barrier to repairing everyday hardware. Most people discard broken electronics because schematics are dense, diagnostic tools are inaccessible, and troubleshooting is highly non-linear. We built Reparo, an autonomous agentic system designed to turn messy, unstructured hardware documentation into an interactive, step-by-step diagnostic guide for consumers.
My primary responsibility was architecting the multi-step LLM reasoning engine and the Retrieval-Augmented Generation (RAG) pipeline. The biggest hurdle wasn't just pulling text from a PDF manual; it was handling context and structure. Hardware troubleshooting is inherently conditional. For example, if a voltage reading is low, you go to step B; if it is completely dead, you go to step C. Standard vector search completely flattens these relationships, leading to dangerous or entirely unhelpful instructions.
To solve this, I bypassed simple vector lookups and implemented an agentic architecture with explicit state management. We parsed schematics into structured knowledge graphs, allowing the LLM to traverse documentation logically rather than guessing based on text similarity. When a user input a symptom, the agent didn't just throw an answer at them; it formulated a hypothesis, generated a targeted troubleshooting step, waited for feedback, and dynamically adjusted its path based on the result.
We pushed through 36 hours of continuous debugging, complex prompt engineering, and edge-case handling to deliver a working deployment that won first place in our track. This project reinforced a massive lesson for me about the reality of building with LLMs: raw generation is cheap, but deterministic execution is hard. True utility doesn't come from a single massive prompt; it comes from constraining the model within a robust architectural pipeline, managing state explicitly, and designing for the friction of real-world user interaction.",Gupta,Karangupta.dev,,Karan,"Generative AI doesn’t diminish creativity; it shifts the bottleneck from mechanical execution to curation, conceptual synthesis, and systemic taste.
Historically, human creativity was tightly bound to technical gatekeeping. If you couldn't paint with precise physical technique, your visual concepts stayed locked in your head. Generative tools change that by making execution essentially free. Anyone can generate a high-fidelity image or a block of boilerplate code in seconds. Because of this, the baseline value of raw output has plummeted. True creativity today is defined by two things: the prompt, which is the starting insight, and the curation, which is the taste required to iterate and judge what is genuinely good.
AI tools don't have intrinsic intent. They operate on statistical correlations, meaning they excel at finding the average of human output. Left entirely to their own devices, they generate predictable, safe content. The modern creative act is using these tools as high-speed feedback loops. It allows a creator to test twenty distinct conceptual directions in an hour rather than spending weeks building just one.
Ultimately, AI democratizes expression by removing the friction of execution, allowing more people to bring complex ideas to life. However, it also raises the bar for what makes an idea truly distinct. When anyone can make something look polished, the only things that stand out are deep human insight, radical originality, and intentionality.",University of Waterloo,"I look for hackathons that move past superficial MVPs and focus heavily on real execution and systems that actually work under stress. At SummerHacks, I want to build alongside people who care about technical depth, whether that means optimizing low-level performance, managing complex state in distributed systems, or moving past basic API wrappers to build truly autonomous software.
Beyond the technical challenge, I am looking to connect with a dense group of builders, engineers, and founders who value shipping fast without cutting corners on engineering fundamentals. I want to spend the weekend solving hard optimization problems, exchanging sharp feedback, and pushing a high-fidelity project across the finish line.",No,N/A,Yes,2030,"Outside of coding, I spend most of my time doing martial arts or just messing around with physical hardware.
Martial arts is a solid reset after staring at a screen all day. It requires a lot of focus, but it forces you to be entirely in the moment since everything is purely physical. You can't really overthink a project when you're actively sparring.
When I am not doing that, I’m usually building things or working on cars. I have always liked taking things apart to see how they work. Lately, that looks like building custom mechanical keyboards or spending time in the garage fixing up and maintaining automotive stuff. There is something satisfying about working with tangible components, diagnosing a mechanical fault with your hands, and getting a physical result that actually works.
Whether I am training or fixing a part, I just like figuring out how things operate under the hood when there isn't a software layer in the way.","I could honestly talk for hours about One Piece, specifically how the entire first half of the story builds up to the Paramount War saga (quick spoiler warning for whoever is reading this, by the way). Oda sets up the stakes so naturally. You meet Ace all the way back in Alabasta, he throws out a casual line about meeting Luffy later at the top, and then heads off to hunt Blackbeard. Hundreds of chapters later, that one hunt completely breaks the world order. Then Sabaody hits and the crew gets absolutely destroyed, which completely flips the usual anime formula. Luffy goes from having a fun adventure with his friends to being totally alone, frantically sprinting through Impel Down and Marineford just to try and save his brother. The payoff is crazy because there are no cheap, random power-ups. It is just years of world-building crashing together at once, and","Honestly, I would choose not being able to tell the difference between a muffin and a baby.
The main reason this is an easy choice is because I don't even eat muffins anyway. Muffins are lowkey just way worse versions of cake that somehow tricked people into thinking they are an acceptable breakfast food. They are dry, usually dense, and have zero reason to exist when actual cake is an option.
Because I have no reason to ever have a muffin in my house, the actual risk of a terrible mix-up drops to basically zero. I can just live my life completely bypassing that entire food group. I would way rather deal with a mild psychological glitch around a food I already avoid than try to fight a grizzly bear swinging sharks at me.",
426323fb-358e-41e4-bb3e-be7ee7fe54ee,frank.xu.hi@gmail.com,2026-06-12 18:35:49.208382+00,pending,,,19,Male,,https://www.linkedin.com/in/frankxu-/,Asian,https://drive.google.com/file/d/1avJ67_gn5V3x9eq6nb9dvsHod3mm3lqP/view?usp=sharing,M,Second,"A project I'm proud of is Pink Tie Planner (pinktieplanner.com), a degree planner that combines 5 tools that Math students currently use to navigate their 16 majors into one unified experience. It marks my pivot toward product design from the traditional math major path of SWE and data, starting as a UX case study through a UW/UX mentorship.

I went through the end to end UX lifecycle, doing user research, making personas, affinity+customer journey mapping, wireframes, prototyping, and then actually shipped it after. The problem started because I was the edge case, unsure if I could fit two niche math majors into my degree. 

I'm proud of January me who signed up for the mentorship last minute, blindly praying that design was the right move for me. I'm also proud of how much I learned, going from knowing nothing about product/UX design to a shipped website that Math majors actually use with new and real skills in my tool belt. 

The biggest challenge I faced was definitely wiring the requirements logic for all the degree plans, as it was quite complex. It was also a challenge that I didn't have the expertise to manually resolve and code the logic, and it's one of the reasons I still want to involve myself in hackathons to stay sharp with technical challenges despite my pivot into design. 

Something valuable I learned was that building is a lot better when you're not alone. As the sole person working on this project, it was going smoothly until the technical problems with the logic started coming in. I couldn't catch every edge case in all 16 majors and all however many minors on my own, so I realized that the only way to make the app more functional was to reach out to community to open it up for user testing. Each person who helped test it brought a unique degree combination that I couldn't have tested myself, turning users into collaborators, receiving unique perspectives and use cases well beyond what I could have done on my own. 
",Xu,,,Frank,"Outside of tech, I'm someone who is big on self-expression. My favourite quote comes from the header of Misfit Ice Cream's website: ""it feels good to fit in, but better to not"". It's why I left SWE for design, as I've always wanted to go into something more creative. I also love trying new things, which is probably another reason I made that blind jump. 

Breaking the rules of the question a bit, design really is everywhere, even when you leave the tech space. I find it in fashion, dressing up boldly for the impulsive Gov Ball tickets we bought in NYC, a city where it felt so normal and good to be different. I find it in architecture, designing cool looking houses and apartments in Sketchup and even Minecraft. I find it in everyday things; my resume is inspired by the Heytea receipt that I saved because it had a clean and unique design. 

Out of the three distinct paths to a good life, success, fulfillment, and psychological richness, I chase the third. I'm into interesting and perspective-changing experiences, the thrill I get while rollerskating, the tears I cry seeing my favourite artists live, and the time I'll have at SummerHacks :)",University of Waterloo,"The idea of building in a sun-lit area is already enough for me, as I'm someone who loves good lighting and good energy, which is something that a lot of the UW study spaces lack... Beyond that, I'd love to connect with the creatives with similar backgrounds as me, and making friends with people in SYDE/GBDA as I don't often get to be in rooms with people who share that same creative-technical intersection. The idea of this hackathon alone and literally the design of this website seems like it'll attract more creatives alongside the CS demons, which is something I'm super excited about!
",n/a,n/a,Yes,1B co-op,,,,
42b606df-4d9d-416b-aac8-82707c07183d,qiub0222@yahoo.com,2026-06-17 09:27:11.251723+00,pending,,,20,Male,https://github.com/Kasawakoku,https://www.linkedin.com/in/bruce-qiu-b56aa7255,Asian,https://drive.google.com/file/d/18ODjgrT7j0ckHbkT6oFF69HXHPPTPXsu/view?usp=sharing,M,Second,"As a part of a school design course, my team built BARRY, a smart roof insulation system that alternates between an insulation layer and a heat-capturing layer to collect daytime heat for indoor heating at night. I was responsible for designing and implementing the software logic to control the motor that switched between these modes, aiming to maintain an internal temperature between 18-27 °C.

Initially, I developed a hysteresis-based design that relied on high and low thresholds for the external temperature, corrected by photoresistor data to account for daytime radiative heat transfer. I chose to defer setting the exact numerical thresholds until the integration phase. However, this led to a major challenge: when trying to establish those thresholds during integration, I discovered the logic was fundamentally flawed because it could not effectively account for seasonal differences or unseasonal weather variations. 

Then, instead of forcing a flawed approach to work, I restarted the logical design process and debated the challenges with my teammates to gain alternative perspectives. We pivoted our strategy, and I systematically redesigned the CircuitPython implementation so BARRY prioritized internal temperature to determine energy demand. The external temperature and photoresistor data were repurposed to assess energy supply, with the photoresistor determining day and night cycles.  

This rapid redesign taught me several critical lessons. I learned that documentation is a lifeline; preserving previous code via GitHub version control and leaving plain-text comments allowed me to easily salvage and adapt past logic into the final model. I also realized the danger of deferring critical design decisions, as leaving the temperature thresholds to the last minute resulted in a heavily rushed integration phase right before our deadline. Finally, I learned the value of failing fast and pivoting. Because later stages of prototyping often expose weaknesses, collaborating with my team to adopt a more stable internal temperature model was far better than trying to patch a broken concept.  ",Qiu,,Bruce,Zhixiang,"I have many niche interests that I know a lot of random trivia in, but one area that has dominated much of my life for a while is aviation. Specifically, I am interested in many different aspects of commercial aviation and commercial airliners: the aircraft types, the designs, the engines, the aerodynamics, the airlines, the manufactuer, the routes, the economics... I often venture out to the airport and stand near the runways to capture photos of airplanes, and I often browse aircraft photos and aviation forums in my spare time. I probably know more about a random airline's operations on the other side of the planet than needed, but this was what had led me to apply to my major (Engineering Science at UofT) in the first place, as it provided me an opportunity of going into aerospace engineering. While I ultimately did not decide on that original pathway, aviation is still a topic that endlessly fascinates me, and I have built on my interests in various ways. For instance, I am currently training a machine learning model to identify aircraft types and airlines based on pictures of airplanes, which I hope to personally use in the future when I go spotting airplanes.",University of Toronto,"The ""outdoors"" nature of SummerHacks was an immediate standout to me. I hope that while sufficient resources and workshops are provided and that I can both learn and build like in a normal hackathon, my wellbeing would also be kept up with regular sessions to the outdoors for relaxation. The word ""retreat"" is, I think, a good way to put what I am looking for: a weekend where I can be free of the stresses of my day job and school, so that I can be both relaxed and in a good state to take on the challenge of building something cool. ",No,No,Yes,,,,,
