id,applicant_email,created_at,status,claimed_by,claimed_at,age,gender,github,linkedin,ethnicity,resumeLink,tshirtSize,yearOfStudy,proudProject,lastNameLegal,portfolioLink,preferredName,firstNameLegal,chooseOneAnswer,institutionName,summerHacksGoal,accessibilityNeeds,dietaryRestrictions,travelToDowntownToronto,year,offlineSelf,rambleTopic,bearOrMuffin,travelToToronto
c4c2ee23-4368-4876-bb13-d05844e741fd,emilyzqsu@gmail.com,2026-06-09 02:18:46.197141+00,pending,,,22,Female,https://github.com/moonsdust/,https://www.linkedin.com/in/emilyzsu/,Asian,https://drive.google.com/file/d/13xShfyhzMP2rMXGCFVsta_Xh2lFtN1ba/view?usp=sharing,M,Fifth and Above,"I was the second author for a human-AI interaction project where we looked at the impact of uncertainty in human to voice agent communication. My role in the project was leading statistical analysis and building machine learning models such as softmax regression and k-means clustering to figure out how voice agents can best express various levels of uncertainty. During this project, I faced challenges such as the model having problems with converging or the model not running all together or finding ways to visualize our results in an informative way. We obtained a paper out of it and it has recently been accepted to a major human-computer interaction journal. A lesson I learned from the project is it’s important to have patience to get through challenges. I believe that without patience, I probably would have given up on fixing problems with our models and we might have not been able to get the paper out of the project. ",Su,emilysu.me,,Emily,"Answering 1, one of the issues I come across in my every day life is navigating the GO train app and figuring out my GO train arrives and if there any problems along the way. There has been so many times where I did not realize that the GO train have changed their time or there are issues that are causing delay until I’m at my station. I would build a small display using an Arduino that is similar to a clock by my bedside table where I can see the upcoming three GO train arrivals and also display a message if there are any delays and why. ",University of Toronto,I hope to build a project out of SummerHacks and also make friends! I haven't been to a hackathon in a while and I have been very eager to build and brush up on my technical skills in a fast-paced setting! I made it a goal this summer to work on my dev skills since I have been in the research world for a while now.,No,N/A,Yes,,"Outside of the tech world, I would say that I am pretty chill and I like to have fun. For example, I really like to go to concerts and go meet other people at different events. I also have a matcha addiction, however I have been trying to cutback. I also love to go to the gym and take dance classes (I used to go to Unionville High School for dance). However, I also like to read and spend time with my friends too. I also used to go Pokemon card hunting/collecting but I have been taking a break since prices have been high. ","I can ramble on and on about Pokemon cards. I have a huge Pokemon card collection and I can ramble about some of the rarest/hard to get cards such as Pikachu With Grey Felt Hat, special Pokemon collaborations, best places to get Pokemon cards, etc. ","I rather not be able to tell the difference between a muffin and a baby. The reason for this is because I don’t really eat muffins and the consequence of losing my arms if the sharks were to lose is way more than not being able to tell the difference between a baby and a muffin, especially if you can easily resist eating muffins for the rest of your life. However, if I was a muffin addict I would pick the fight since I can easily just build prosthetic arms if I did lose so I can still eat my muffins. ",
c60a29ac-fa6f-4ea2-82a4-db6d66e6cf5e,pranavnks@gmail.com,2026-06-08 23:08:04.536126+00,pending,,,20,Male,https://github.com/PRU1,https://www.linkedin.com/in/pranav-upreti/,Asian,https://pranavupreti.ca/static/media/industry.6cbcbd3b633ee5447b4f.pdf,L,Third,"I am proud of my first completed hackathon project. My practical
coding skills are rusty and have been for a while (I am not a CS major
;-;, and the coding I do is mostly to accelerate computations, plot
graphs, regression analysis, etc.). So by second year uni I had pretty
much forgotten how to do basic things like create a website.

Our goal was to create a virtual aircraft traffic controller. The
motivation was that audio signals sent from transmission towers to
airplanes often get muddled and prone to miscommunication (i.e. people
with different accents can be hard to understand). We initially wanted
to have an audio model decipher audio between the pilot and the
transmission towers but the API kept on bugging out. Every other team
we talked to had the same issue so we decided to pivot to transcribing
a text command to audio with their API. This was an unfortunate
setback but after doing an all nighter to figure it out, we decided a
simpler completed project is better than something incomplete (with a
bug we cannot fix).  The Higgs Boson text to speech models were
reliable so we used that to transcribe a voice command (i.e. telling
the plane to move somewhere), built a scrappy plot visualization with
matplotlib so the user could see the plane movement react to a voice
command.

I handled most of the front-end and back-end. We used streamlit API
which integrated nicely with the matplotlib visualization my team
member worked on. I learned (the admittedly basic) skills of full
stack development.",Upreti,https://pranavupreti.ca,Pranav,Pranav,"My dog Milo refuses to walk without the entire family at night for whatever
reason. It isn't always possible for my mom and dad to come on the
walk every night with us, so this is a challenge. Although Milo is
extremely treat motivated, I have had little success luring on the walk with
treats. I need to experiment to develop a suitable solution. There are
two categories to test: (i) force my parents to consistently come, or
(ii) force Milo to come. My parents are a force of nature so that
rules out (any ethical) means to achieve (i). Achieving (ii) is
similarly difficult because I cannot force Milo to do something he
doesn't want to. Perhaps my best bet is to entice him to walk. I
propose purchasing a barrow for him to sit in, and as I carry it
around his curiosity to sniff will tempt him to get out and walk. If
he sploots, I lift him on the barrow and continue walking. I could
also convince my parents to get another dog, so he might be more
willing to wander without the entire pack (my parents and I) being around.
",University of Toronto,"I want to go outside. I am always indoors, coding, all day long. I
usually also like working through weekends (my job is pretty
intensive) so I'd like to take a break and enjoy the outdoors with
friends. I do not have much hackathon experience so I am curious what
I can do now that I'm a professional vibe coder with my job.",No,vegetarian and allergic to egg,Yes,2026,"I have a dog, he is very cute. His name is Milo, he is a golden
retriever and labrador retriever mix. I take him for walks, he takes
me for walks too. I love my dog.
","Integrated silicon photonics. I believe it's the future. Traditional compute
has reached fundamental physics limits. Moore's law is dead as we are
reaching the limits to how small and efficient we can make transistors
without quantum effects becoming significant (and making any chip
unpredictable). The next frontier is in fundamentally reimagining how
compute is performed, using photons instead of electrons. The most
tangible immediate advantage is by using optical interconnects instead
of traditional electrical connections. In data centers, we have many
independent processors that need to be connected to communicate with
each other. Using electrical connections lose the shape of the
electrical signal much quicker than light, and as a result can
transmit a limited amount (bandwidth) of information. The bandwidth
using an optical connection is several orders of magnitude greater,
and doesn't come with the heat production of electrical connections.  ","I would rather fight a bear with sharks for arms because I would not
be able to handle the possibility of accidentally eating a baby
because I thought it was a muffin. Presumably I can run and swim quickly enough
from a baby (I'm imagining the shark arms would not allow a baby to be
quick to swim because of how uncoordinated it would be) so I can get
to safety (away from shark arms) reasonably easy. Be nice.
",
c62c5f9d-d3b4-4d1a-a99e-939202bd8097,flyshark2006@gmail.com,2026-06-18 03:13:14.293343+00,pending,,,19,Male,https://github.com/hanDynasty0,www.linkedin.com/in/han-yu-fang,Asian,https://drive.google.com/file/d/1Y0Eai0Zy5Nny9WbbvakZ0pfQ5BELVqRZ/view?usp=sharing,L,Third,"I'm proud of my current role as a project colead for UTMIST's Bigger Bird project, the goal of which is to improve upon Google's BigBird sparse attention mechanism by improving the adaptiveness of its token selection. Throughout this project, I learned a lot of technical details, like how attention and sparse attention work, and how GPUs optimize attention computation. I also overcame challenges relating to collaborating with a lot of people (8 to be precise), whether that be getting used to version control with Git, remote-accessing a team member's compute resources, or setting goals for meetings and for the project as a whole. Finally, I've gained a lot of experience leading this team through setting and following meeting agendas and organizing a coherent team structure, which has allowed our team to be productive. Currently, our team is even producing preliminary results which suggest our patch could beat BigBird on both accuracy and training time, so the sky really is the limit here.",Fang,,Han,Han Yu,"Outside of my work and project life, I like playing sports, particularly basketball, which I got into in high school and played with friends over multiple summers, as well as table tennis, where I'd describe myself as a (somewhat washed) professional basement player. I also like playing chess, which I also started playing in high school and improved steadily at it over the years (my most recent games include a 10-0 bashing of one of my friends). Finally, I just recently got into working out (a bit late, I realize), which I do every weekday after I get off work.",University of Toronto,"At SummerHacks, I hope to improve my software development skills, and I think that the rapid prototyping environment that this hackathon will likely induce will be a great place for me to do so. I also look forward to meeting people from different backgrounds, learning new tools, and building a project that I can be proud of.",No,N/A,Yes,,,,,
c72adddb-62bd-4889-837e-c109b350759a,jeremyliu621@gmail.com,2026-06-19 01:31:36.391416+00,pending,,,18,Male,https://github.com/jeremyliu-621,https://www.linkedin.com/in/jmyl/,Asian,https://drive.google.com/file/d/1RoXgM2Gs5AGkjgrm66MmK9UKjB2REBrF/view?usp=sharing,XXL,First,https://wearegettingintosummerhacks.vercel.app/,Liu,https://jeremyliu.space/,Jeremy Liu,Jeremy,"Answer to 2 (and a bit of 1):

I'll try to keep this shorter because I appreciate the world outside of the online just as much as you do.

I'll start by saying that I'm a firm believer that it's getting harder and harder to pursue the things that we want to do the most, as we are becoming more and more blinded by notions of prestige, power, and money., things that bring us immediate pleasure but perhaps long-term longing.

For me, I understand that to live a comfortable life I have to bow down to those aspirations to some extent, but I pride myself in being blunt about it. So: as much as I love building and technology, all I truly want to do is exit a company before I turn 30, spend most of my earnings retiring my family, and then use the rest of my income to travel the world under a new identity.

I don't want to travel commercially, I am also a firm believer that travelling professionally/commercially allows one to only experience a simulacra of what it actually is. I'd much rather bikepack, travel homeless, sleep under the stars, befriend every single one of the 8 billion, beautiful souls on this planet, learn local languages, morph between different cultures, read and fully appreciate books, poems, historical sites, of fascinatingly different villas and slums.

I'm one to try and finish all the grueling work just so I can spend more time doing the things I want.

Nevertheless, the hackathon's likely full, so all this rambling is for naught lol",University of Toronto,"I like hackathons where there's more freedom to build something I genuinely want to build, rather than be constrained to boring tracks, themes, etc, and where the lack of professional pressure lets hackers build something more fun. Thus, an Ideal time at SummerHacks would be one where enjoying a unique experience is primary and hacking, although important, is secondary. ",nah,N/A,Yes,,,,,
c83a3875-93e8-47c4-8dd1-1a10579ed427,jadenlaw4@gmail.com,2026-06-03 00:13:07.095737+00,in_review,rev_itutaclqt,2026-06-16 21:48:14.683099+00,21,Female,https://github.com/j2law,https://www.linkedin.com/mynetwork/invite-connect/connections/,Asian,https://drive.google.com/file/d/1OemnMtOhkl7RmLqHNGu7pp4kJvAhTUwI/view?usp=sharing,M,,"A project that I am particularly proud of is a full stack MERN application called Matchify that I built with classmates at York University. Matchify is a dating application that matches users based on their Spotify music preferences. This project was especially meaningful to me because it was one of my first experiences working collaboratively in a software development team environment.
I took on the role of team leader, where I helped coordinate meetings, distribute tasks among teammates, and establish coding standards and project structure to ensure consistency across the application. I also contributed to both the frontend and backend development of the project.
One of the biggest challenges we faced was disagreements regarding design decisions and feature implementation. Since everyone had different ideas and perspectives, it was sometimes difficult to reach a consensus. To solve this, I encouraged open discussions where each teammate could explain their reasoning, and we focused on choosing solutions based on what would best support the project goals and user experience. This helped us improve communication and collaborate more effectively as a team.
Through this experience, I learned the importance of leadership, teamwork, adaptability, and clear communication in software development. I also gained a better understanding of how collaborative planning and maintaining organized code structures can make large projects much easier to manage.",Law,,,Jaden,"An issue I regularly come across in my day to day life is prioritizing and managing multiple competing tasks. Outside of school assignments, exams, and work responsibilities, I also have chores, personal plans, and various miscellaneous tasks that need to be completed within limited time. The challenge is not just completing tasks, but deciding what to focus on first, especially when deadlines overlap or unexpected responsibilities come up.
To solve this, I would often use a structured time management system where I can schedule and prioritize appropriately. I would categorize tasks based on urgency and importance, and then map them into a spreadsheet and on Google calendar. This would help me visually balance academic, personal, and work commitments instead of relying on memory or reacting to tasks as they come.
Additionally, I would break larger tasks into smaller steps and assign realistic time blocks for each one. This reduces procrastination and makes it easier to make consistent progress throughout the day. I would also leave buffer time in my schedule to account for unexpected tasks or delays. Over time, this approach would help me stay more organized, reduce stress, and ensure that I am consistently meeting my commitments without last minute pressure.",York University,"There are a few things I want to get out of SummerHacks. First, I want to meet more like minded people who are interested in technology, problem solving, and building projects. I think being around others who are equally motivated and curious creates an environment where I can learn new perspectives and maybe even form connections beyond the event. Second, I want to have fun while building something. Hackathons are a great way to work on something creative under time constraints, and I’m looking forward to that experience. Lastly, I hope to build a project that I can look back on and feel proud of. Even if it is simple, I want it to be something I fully develop during the event and use it as a learning experience to improve my technical skills. ",Nope,N/A,Yes,4,"Outside of the tech world, I spend most of my time hanging out with friends, playing games (especially Valorant and TFT), and I LOVE playing pickleball. I like anything that gets me moving or competing a bit, but I also just value spending time with people and unwinding. I’m also constantly exploring new interests and picking up new hobbies whenever something catches my attention, so my offline life tends to stay pretty  active.","A random topic I could easily ramble on about is K-pop. I’ve been a fan since I was around 10 years old, and over the years it’s become something I genuinely enjoy and keep coming back to. I really like how complete the experience is, it’s not just the music, but also the performance, choreography, visuals, and overall production that go into each comeback.
I always find it fun to follow different groups and see how their sound and image evolve over time. It’s something I could talk about for a long time because there’s always something new happening, whether it’s new music releases, performances, or trends in the industry. And I love going to concerts as well!","I would choose to fight the bear with sharks for arms. Although it sounds scary, it is still a single, one time situation that I can understand and prepare for. I know and can brace for what I am going against, even if it’s greatly overpowered. On the other hand, not being able to tell the difference between a muffin and a baby would affect my judgment in everyday life in a much deeper and more serious way. It would constantly create confusion in situations where accuracy really matters, and that kind of uncertainty would follow me everywhere. So even though the bear is obviously dangerous, it feels like the more manageable option compared to something that permanently disrupts basic perception.",
