id,applicant_email,created_at,status,claimed_by,claimed_at,age,gender,github,linkedin,ethnicity,resumeLink,tshirtSize,yearOfStudy,proudProject,lastNameLegal,portfolioLink,preferredName,firstNameLegal,chooseOneAnswer,institutionName,summerHacksGoal,accessibilityNeeds,dietaryRestrictions,travelToDowntownToronto,year,offlineSelf,rambleTopic,bearOrMuffin,travelToToronto
0028e20e-ecd1-4b37-89c8-2a2945e8dd16,hudanny295@gmail.com,2026-06-18 16:18:32.186889+00,pending,,,21,Prefer not to say,https://github.com/Danh295,https://www.linkedin.com/in/danny-hu-395380225/,Prefer not to say,https://drive.google.com/file/d/1KnX6BcWYPE-gDQp_ux_WVXGzEIldH-mI/view?usp=sharing,M,Third,"Last co-op term, I was the sole developer on a parking ticket digitization tool for the City of Waterloo; a system to turn handwritten tickets into structured data. I owned the whole thing end to end, which was exciting just as it was terrifying, because I had no background in computer vision, OCR, or model training when I started.
The hardest part wasn't any single technical problem — it was that the problem was simply too big to hold in my head at once. Early on I'd stare at model outputs and documentation with no idea where to even start. But eventually, I was able to break it into stages: instead of ""build a handwriting recognizer,"" it became ten small, attackable problems chained together. By the end, I got that pipeline hit over 92% per-field accuracy in production.

The lesson that stuck with me was that almost any problem that looks impossible from the outside is just a problem I haven't decomposed yet. I also learned to stop polishing and ship, as a model that works at 92% and exists beats a perfect one that never leaves my laptop.",Hu,,Danny,Yiheng,"Outside of what I build, I'm happiest working with my hands and spending time with people I love. I love playing the guitar, and I have been playing a variety of genres since I was in high school, though I'm currently focused on classical guitar and slowly working towards the RCM exams in my own time. I also used to play drums and bass clarinet in orchestras, but dropped both of these things when things got busy. Though, I've been hoping to find another opportunity to pick those back up.

I'm also an avid gym-goer and love rock climbing too. I wouldn't call myself a gym bro though, maybe an ex-gym bro, because I would be lying if I said I've been consistently going 4-5 days a week.

My favourite version of myself shows up around my closest friends and people. I just took a nine-day trip with my 2 closest friends in Tokyo together 2 months ago. This was the kind of trip where half the good memories are the small disasters; getting lost, mistranslating menus, figuring it out as we went. I think I like travel for the same reason I like climbing and hackathons -- being dropped somewhere I don't quite know how to navigate yet, and having to figure it out with people I trust. Strip away the tech and it's still the same me, I just like the feeling of working something out with my hands and the people next to me.",University of Waterloo + Wilfrid Laurier University,"I've done around 10 hackathons now, and most of them blur together into the same memory: a windowless room, fluorescent lights, everyone hunched over laptops until 4am. 

I've built good things in those rooms, but the building is rarely the part I remember fondly.

An ideal SummerHacks is the inverse of that. An environment where stepping outside between problems is part of the process, not a guilty break, where a hard bug gets solved on a walk instead of by staring harder at the screen. I want to actually talk to my teammates as people, not just as Slack or Discord messages two feet away. And I'd love to walk away with something I'm still tinkering with in September, plus a couple of people I'd want to build with again. If I leave having made something real and remembering the weekend warmly, that would be more than ideal for me.",Nope,N/A,Yes,,,,,
02151c31-2502-4d1c-94a3-7afca425b6fc,jadon.tsai@mail.utoronto.ca,2026-06-12 01:35:52.408076+00,pending,,,20,Male,https://github.com/jadontsai,https://www.linkedin.com/in/jadontsai/,Asian,https://drive.google.com/file/d/1LZNxotnPlCK-n3OxjPiwTd9CXyVTs8hr/view?usp=sharing,L,Second,"I'm proud of a robotic trashcan I made as part of an embedded systems course at UofT (MIE438). It was challenging because we didn't really have a framework, it just had to work and use embedded parts. I learned a lot about how to use the STM family of parts, which was a pretty big learning curve. It was also challenging because we had to retool on the fly, since our initial idea of a computer vision tracking thing did not have nearly enough memory to work.",Tsai,,,Jadon,"Outside of tech, I like to be outdoors, whether that be to run or more often this summer as part of a dragon boat team. I think it's a very nice change of pace from staring at a computer all day, and a good way to stay fit.",University of Toronto,Having fun meeting new people and learning about new technical skills.,N/A,N/A,Yes,2,,,I like muffins and I don't like cannibalism so I can't pick the second option. I actually don't think the first option would be that bad though. Sharks aren't *that*,
027258f4-54b3-47c1-863f-162dc57bed71,viaje1579@gmail.com,2026-06-10 02:51:14.058858+00,pending,,,22,Male,https://github.com/brandonviaje,https://www.linkedin.com/in/brandon-viaje/,Asian,https://brandonviaje.github.io/Brandon_Viaje_Resume.pdf,L,Third,"One project that I enjoyed doing was building a web crawler in C++. I wanted to challenge myself after taking a systems programming course and learn more about optimizations such as concurrency, thread pooling and also thread safe data structures. Learning about how concurrency is applied in the real world and understanding the tradeoffs were a huge challenge since it took a lot of trial and error. I learned about the tradeoffs in concurrency, and how overhead can slow programs that respond in milliseconds down.",Viaje,https://brandonviaje.github.io/,Brandon,Brandon,"1. I find it interesting how smartphones have almost eliminated boredom. Every idle moment can now be filled with content. I'm curious about how this changes creativity, attention spans, learning and the way people think.

2. Outside of tech, you can see me going to the gym, playing piano and also fishing. Currently, I have been fishing and working out mostly since school is out. I am someone that is always wanting to learn something new and talk to people.",Ontario Tech University,"An ideal time at Summerhacks is a place where I can learn from other people, meet new people and also be able to have fun with building as a community,",N/A,N/A,Yes,,,,,
036cfac8-28a9-4d36-b817-e030ea5ed238,mksha2312@gmail.com,2026-06-16 19:18:57.836443+00,pending,,,19,Female,https://github.com/MokshaP007,www.linkedin.com/in/moksha-p-b1630236b,Asian,https://www.overleaf.com/download/project/6a2c77607ec0448793e64bd3/build/19ed1d48e0e-bd685278a211a74f/output/output.pdf?compileGroup=standard&clsiserverid=clsi-pre-emp-c3d-c-f-60p9&enable_pdf_caching=true&popupDownload=true&editorId=625612c7-5428-4cc3-96f6-327a40674633,L,First,"I am incredibly proud of designing a platform framework for Velocty's Future Cities Innovation challenge called the AI Civic Nexus. The vision behind this project was to tackle a fundamental flaw in modern urban planning: standard municipal policies and technological upgrades are usually ""one-size-fits-all,"" inadvertently alienating marginalized, vulnerable, or niche communities.
As the Lead Visionary and UX Designer, I created a comprehensive Figma prototype for an AI-driven governance hub. The platform acts as a smart community connector, designed to intercept zero-sum neighborhood conflicts across all demographics—ranging from neurodivergent individuals and senior citizens to families, youth, and physically disabled residents—and automatically synthesize empathetic, balanced middle grounds.

The main challenge was designing an interface that could take complex human friction and translate it into a unified, actionable resolution. To test the framework, I mapped a tough, multi-demographic case study: an infrastructure dispute between senior citizens requiring maximum pathway visibility to prevent physical injury, and neurodivergent residents suffering severe sensory overload from high-intensity city lighting glare.
It was a classic representation of a zero-sum urban design flaw. In traditional city planning, administrators are forced to choose one community's well-being over another, inevitably making someone feel excluded or unseen in their own neighborhood. My hurdle was figuring out how a digital platform could gracefully map these conflicting human variables into a single, cohesive experience.
How I Solved It (The Figma Prototype)
Instead of choosing a side, I used Figma to map out an end-to-end user experience that engineered a hidden middle ground, demonstrating how cross-community needs can be met simultaneously:
The Policy Mediation Interface: I mapped a conversational dashboard that visualizes conflicting community requirements being parsed by the system.
Adaptive Simulation: The prototype illustrates a smart infrastructure transition—simulating a late-night lighting shift to downward-focused, warm-toned spectrums that preserve window darkness for sensory-sensitive residents, while maintaining motion-triggered brightness strictly on the pavement for walking seniors.
Cross-Community Integration: To completely bridge the gap, I designed a feature linking this infrastructure resolution to a localized volunteer portal. If any resident needs extra support during these altered late-night hours, they can instantly request a community escort.
Lessons Learned
This project taught me that true inclusion cannot be built with a one-size-fits-all mindset. I learned that as designers, our job isn't to look for a compromised baseline that leaves everyone slightly unhappy; it is to use empathetic design to uncover creative alternatives where multiple communities can thrive together. Building this prototype proved to me that thoughtful UX can transform rigid municipal friction into an opportunity for deep community connection and mutual care.",Pandit,,Moksha,Moksha,"An ideal ramble for me would be the deep, almost poetic intersection of pure mathematics and computer science. Most people look at programming and think it's just about memorizing syntax, writing loops, or building apps, but underneath the hood, computer science is really just math that we taught a piece of silicon to calculate incredibly fast.
I could go on forever about discrete mathematics, which acts as the hidden nervous system for everything we build. Take graph theory, for example; it is the exact math Google Maps uses to solve the shortest path problem across a massive grid of city streets in milliseconds, treating intersections as nodes and roads as edges. There is also something deeply fascinating about cryptography and how modern data privacy hinges on number theory, specifically the asymmetry of prime numbers. A computer can multiply two massive primes instantly, but reversing that process to find the original factors takes billions of years, meaning the security of global banking literally relies on a math problem being too ""hard"" to solve backwards.
If you want to get truly philosophical, the theory of computation proves mathematically that there are some problems a machine can never solve, no matter how much memory or time you give it. Even the current wave of artificial intelligence isn't some magical, thinking sci-fi brain—it is just linear algebra and multi-variable calculus running on an unimaginable scale. When an AI parses an image or a sentence, it converts everything into numerical vectors and performs billions of matrix multiplications to predict what should come next. Realizing that writing code is actually just orchestrating a symphony of ancient mathematical rules makes the entire field feel less like engineering and more like art.",University of Waterloo,"An ideal time at SummerHacks for me centers around high-velocity, disciplined building. While the social side of hackathons is great, my peak element is being completely locked into the engineering phase—working alongside a team that values clean architecture and execution just as much as a great idea.
My ideal weekend looks like tackling the heaviest technical bottlenecks of the project: architecting an efficient backend data flow, hunting down complex integration bugs in the middle of the night, and ensuring the final implementation is optimized and stable. I love the high-energy pivot on Saturday when a team has to strip away the fluff to focus on a killer 'hero' feature, and the adrenaline of polishing a live, fully functional deployment for the judges on Sunday morning. Ultimately, a successful hackathon for me means walking away with a bulletproof codebase that I’m genuinely proud to pin to my GitHub profile.",No,Vegetarian ,Yes,,,,,
054eb3b0-980b-4fa9-9e4c-134acd971a69,suhikasim1@gmail.com,2026-06-04 20:48:16.783296+00,pending,,,20,Male,https://github.com,https://www.linkedin.com/in/suhiyini-kasim-ba4b99333/,Black,https://drive.google.com/file/d/1b58t5eFTG1eC1Q79QH0J701iQAJA9NrV/view?usp=share_link,M,,"One project I’m proud of is an AI-powered sustainable home design app I built during a hackathon. The idea was simple: a user describes their dream home, and the app generates a sustainable house concept with a 3D model, 2D floor plan, and design recommendations based on climate, materials, and energy efficiency.
My role was mainly on the AI and product side. I worked on shaping the core user flow, connecting the user’s prompt to the AI output, and helping turn the idea into something demo-ready instead of just a cool concept. The hardest part was the 3D generation feature. It was supposed to be the “wow” factor of our demo, but close to submission it started breaking badly: houses had windows on roofs, missing doors, and chimneys floating in the air. We had to debug under pressure, simplify the generation logic, and make the demo reliable enough to present.
The biggest lesson I learned was that a hackathon project is not judged only by how ambitious the idea is. It also has to work when it matters. I learned to prioritize the main user experience, cut unnecessary complexity, and communicate clearly with teammates when things go wrong.",Kasim,https://portfolio-website-hazel-phi-73.vercel.app,,Suhiyini,"One issue I run into often is how difficult it is for students and young developers to know whether they are actually learning or just producing things with the help of AI tools. AI can help you build faster, but it can also make you lazy without realizing it. You may understand the final code at a high level, but still struggle to recreate it from scratch.
I would solve this by building a learning tool that turns AI-assisted coding into active practice. Instead of only generating code, the tool would ask the user to explain the code, predict what each section does, fix small bugs, and rebuild parts of the project without help. It could track which concepts the user keeps depending on AI for, such as API routes, database queries, authentication, or state management.
The goal would not be to shame people for using AI. That is unrealistic. The goal would be to make AI a better teacher instead of a crutch. The best version of this tool would help students build real projects while still forcing them to develop actual independence.",University of Toronto,"I want to leave Summerhacks with a better sense of how to build under pressure with other people. I’ve built projects before, but hackathons force you to make decisions quickly, cut bad ideas early, and ship something that actually works. I’m also hoping to meet people who are stronger than me in different areas, especially design, backend systems, AI, and pitching. I want to learn from how they think and work. Winning would be great, obviously, but the bigger goal is to come out with a stronger project, better teammates, and a clearer understanding of where I need to improve as a developer. I also can't wait to see what my first outdoor hackathon is gonna be like!",No,N/A,Yes,3,"Outside of tech, I’m someone who likes languages, music, games, and learning random things deeply. I can read and write Japanese, Arabic, and Korean, and I understand casual Japanese and French. I like the process of getting good at something that feels impossible at first, especially when it starts clicking piece by piece. I’m also into gaming, not just playing games but thinking about why certain games are great, why others fail, and how stories, mechanics, and player experience come together. I enjoy music a lot too, especially artists like Beyoncé, Jay-Z, and Kanye West. I’d say I’m naturally curious, but also self-critical. I like improving, sometimes too intensely, and I’m trying to get better at balancing ambition with actually enjoying the process.","I could ramble for hours about how AI is changing creativity, especially in areas like games, anime, music, and content creation. I’m interested in the line between AI as a tool and AI as a replacement for human taste. A lot of people frame the conversation too simply: either AI is evil and ruins art, or AI is amazing and makes everyone creative. I think the truth is messier. AI can help more people express ideas they did not previously have the technical skill to create. But it can also flood the internet with lazy, generic work if people use it without taste or intention. The part I find interesting is not just whether AI can create something. It is whether the human behind it has enough vision to make the result worth caring about.","I would rather fight the bear with sharks for arms. It sounds terrible, but at least the problem is clear. There is a bear, it has shark arms, and I know I need to run, hide, or accept my fate with some dignity. Not being able to tell the difference between a muffin and a baby is much worse because it destroys your ability to function in normal society. Every breakfast becomes a legal and moral crisis. Every bakery becomes a danger zone. Every baby shower becomes a high-risk environment. You would spend your entire life asking people, “Is this food or a child?” and nobody would ever trust you around either. With the bear-shark situation, I probably lose once. With the muffin-baby situation, I lose every single day.",
058b06dc-e2b4-46d3-8dd9-d17abe1ff475,arjunpunmagar001@gmail.com,2026-06-02 03:59:45.112353+00,in_review,rev_itutaclqt,2026-06-16 21:23:30.175019+00,22,Male,arjunmagarcode,https://www.linkedin.com/in/arjunpmagar/,Asian,https://drive.google.com/file/d/1OiiSfn17FEykePqJmvBcW2WEi_UjRASb/view?usp=sharing,S,,"One project I am especially proud of is Hearsay, an AI-powered language learning platform that I built with a team. My role focused on developing both the frontend and backend, integrating AI features, and connecting hardware components for hands-free interaction.

The biggest challenge was bringing together multiple technologies, including React, FastAPI, Google Gemini, ElevenLabs, and Arduino sensors, into one seamless user experience. Ensuring low-latency communication between the hardware and software while maintaining reliability required a lot of testing and debugging.

Through this project, I learned the importance of designing systems that are both technically effective and user-friendly. I also gained valuable experience working across the full stack, integrating AI tools, and collaborating with others to solve complex problems. Seeing users interact with a product that combined AI, software, and hardware in a meaningful way made the experience especially rewarding.
",Pun Magar,https://arjunportfolio1.vercel.app/,,Arjun ,"One issue I often notice is that students have access to many learning resources, but it can be difficult to stay organized and know what to focus on. Many students fall behind not because they lack ability, but because they lack personalized guidance.

I would solve this by creating an AI-powered academic assistant that tracks coursework, study habits, and performance data to provide personalized recommendations. The system could identify struggling areas, suggest study plans, and remind students about upcoming deadlines. By combining data analytics with AI, students could receive support tailored to their individual needs rather than following a one-size-fits-all approach.

As someone interested in AI and education technology, I believe tools like this could help students learn more effectively and reduce unnecessary stress.
",The University of Southern Mississippi,"I hope to get three things out of SummerHacks: meaningful connections, hands-on experience, and personal growth. One of the things I enjoy most about hackathons is being surrounded by ambitious and creative people who are excited to build. I’m looking forward to meeting students from different backgrounds, learning from their perspectives, and forming friendships that extend beyond the event itself. I also want to challenge myself technically. While I have experience building full-stack and AI-powered projects, SummerHacks is an opportunity to work under pressure, experiment with new technologies, and create something impactful in a short amount of time. Some of my biggest learning moments have come from projects that pushed me outside my comfort zone. Most importantly, I hope to leave inspired. Whether through workshops, mentors, or conversations with other participants, I want to gain new ideas and perspectives that will help me grow as both an engineer and a",No,N/A,Yes,3rd ,"Outside of technology, I'm someone who enjoys learning, meeting new people, and staying involved on campus. As a first-generation college student from Nepal studying in the United States, a big part of my life has been adapting to new environments and building connections with people from different backgrounds.

I enjoy participating in hackathons and student organizations, but I also value spending time with friends, exploring new places, and staying connected with my family. Sports, music, and long conversations about random ideas are some of my favorite ways to unwind.

I also enjoy mentoring and helping others whenever I can, whether that's assisting fellow students with coursework or sharing experiences with prospective students as a CS ambassador. While technology is a major passion of mine, I try to approach life with curiosity, humility, and a willingness to learn from the people around me.
","I could probably ramble for hours about how technology changes the way people learn. I find it fascinating how a single tool can completely transform someone's ability to understand a topic, whether it's YouTube tutorials, coding platforms, or AI-powered learning assistants.

As someone who enjoys building software, I often think about what makes educational tools actually effective. Why do some apps keep people engaged while others get abandoned after a week? How can AI personalize learning without making students overly dependent on it? These are questions I genuinely enjoy discussing.

I also love exploring the intersection of psychology and technology—how habits are formed, how motivation works, and how software can help people learn more efficiently. It's one of those topics where every answer leads to three new questions, which is probably why I never get tired of talking about it.
","I would rather fight a bear with sharks for arms. The alternative never being able to tell the difference between a muffin and a baby is genuinely terrifying. Every breakfast, family gathering, or trip to a grocery store would become a high-stakes decision. I don't think I could function normally knowing that I might confuse baked goods with human infants. Fighting a bear with sharks for arms is obviously absurd and probably not ending well for me, but at least there is a chance. Maybe the sharks are surprisingly effective. Maybe the bear is confused. Maybe everyone involved decides this situation is too ridiculous to continue. There are at least a few possible outcomes. The muffin-and-baby scenario offers no such hope. It would permanently affect every aspect of daily life and make me an immediate liability to society. Therefore, I will take my chances with the bear and the shark",
06edf719-d0f2-42e7-8334-074dac64dee5,zhanger6417@gmail.com,2026-06-13 01:37:12.725804+00,pending,,,20,Male,https://github.com/Ederexre,linkedin.com/in/eric-zhang-4699811b8,Asian,https://docs.google.com/document/d/18aoIY-X293xZhdNu9FeXmL_aWlSEyrSGpkQbMDopmKs/edit?usp=sharing,L,Second,"In a recent school group project, my team created a typing game. I helped create the shop, reactive level select screen, and powerup UI  with functionality for 2 of them. The biggest challenge we faced was time pressure to get all the requirements finished before the deadline. We had to learn to delegate tasks and trust each other to finish our parts.",Zhang,,Eric,Eric,"I suppose a game I could ramble on about is Honkai: Star Rail. Its lore, the story, the characters and the stats to build.",University of Western Ontario,"Ideally, I bring along some friends and we hash out a project by collaborating together and have some fun along the way.",No,N/A,Yes,,,,,
