id,applicant_email,created_at,status,claimed_by,claimed_at,age,gender,github,linkedin,ethnicity,resumeLink,tshirtSize,yearOfStudy,proudProject,lastNameLegal,portfolioLink,preferredName,firstNameLegal,chooseOneAnswer,institutionName,summerHacksGoal,accessibilityNeeds,dietaryRestrictions,travelToDowntownToronto,year,offlineSelf,rambleTopic,bearOrMuffin,travelToToronto
8728544f-feee-42c6-abee-8ff17c8fd25d,sabeenk2006@gmail.com,2026-06-02 05:17:22.255655+00,in_review,rev_itutaclqt,2026-06-16 21:24:46.348063+00,20,Female,https://github.com/sabeenkhan06,www.linkedin.com/in/sabeenkhan06,Asian,https://drive.google.com/file/d/1j0VdZWR2Dr5JIdgV_8KmkVC5feSOYs5Y/view?usp=sharing,S,,"One project I am particularly proud of was a supplier evaluation and cost-benefit analysis project completed during my finance studies. My role was to analyze multiple suppliers across pricing, lead times, quality, and risk factors to determine the best vendor.

One challenge was balancing cost savings with operational risks, as the lowest-cost supplier was not always the most reliable. I built an Excel model for KPI tracking and compared different scenarios to support decision-making.

Through this project, I strengthened my analytical and problem-solving skills and learned the importance of using data to support business decisions rather than focusing on a single metric such as cost.",Khan,,,Sabeen,"1. Here's a concise response for option 1:

One issue I frequently come across is that students have access to a vast amount of information, but often struggle to put it into action. Many attend workshops, watch tutorials, or take courses, but never get the opportunity to apply what they learn in a practical setting.

I would solve this by creating more hands-on communities and events where people can immediately apply new skills. For example, instead of only teaching entrepreneurship or finance concepts, students could work on real projects, participate in case competitions, or develop business ideas alongside their peers.

I believe the biggest barrier is often not a lack of knowledge, but a lack of opportunities to practice. Creating environments that encourage action, collaboration, and experimentation can help bridge that gap.",Sheridan College,"I hope to gain experience building a project from idea to execution alongside talented and driven people. While I have developed technical skills through projects involving AI, data analysis, SQL, and Excel, I want to continue strengthening those skills by working on real-world problems in a collaborative environment.

I'm also looking forward to meeting people from diverse backgrounds, exchanging ideas, and learning from mentors and participants who bring varied perspectives. By the end of SummerHacks, I hope to have expanded both my technical and problem-solving abilities, built meaningful connections, and contributed to a project that creates real value.",N/A,Halal !,Yes,4,"Outside of tech, I enjoy bringing people together and creating communities. I recently founded a student business and entrepreneurship club because I wanted to create a space where students could meet like-minded peers, exchange ideas, and learn from one another.

I also enjoy photography, music, and exploring new coffee shops and places around the city. A lot of my free time is spent attending events, meeting new people, and working on creative projects. I like learning new things, whether that's through conversations, books, or trying something I've never done before.","I could probably talk for hours about business ideas and why some succeed while others don't. I find it interesting how things like branding, customer experience, or even timing can make a huge difference. I often catch myself looking at businesses and thinking about what I would do differently.

Other than that, I could definitely ramble about music. I love discovering new artists and talking about albums and songs with friends. I'm especially interested in how artists change the tone, production, or style of their music to convey stronger emotions and tell a story. Once I notice something like that, I tend to go down a rabbit hole analyzing the choices behind it.","I think... I would rather have bacon but no games, but also be open to having the option of games... but no games. I believe this benefits my life in ways not many people would recognize. The feeling of the bacon while games, but no games while bacon. These are my honest thoughts.

I have spent considerable time thinking about this and remain confident in my position.",
8957b0ad-6aa6-457e-bd0e-eb7abc42a9e5,dumasuthan@gmail.com,2026-06-13 19:22:01.796193+00,pending,,,22,Female,https://github.com/dhivyauma,www.linkedin.com/in/dhivya-umasuthan,Asian,https://www.overleaf.com/read/pzygfhndmfrj#9f9979,M,Fifth and Above,"One project I'm particularly proud of is a gut microbiome disease classifier I built with a team of four at a DataQuest Hackathon. The goal was to classify patients into one of three groups (Crohn's disease, ulcerative colitis, or healthy) using microbiome sample data from the GMrepo database.

My role was leading the data preprocessing and model development. We were working with over 2,000 features across 2,105 samples, which meant the data was high-dimensional, sparse, and imbalanced, making it a genuinely hard classification problem. I applied L1-regularized logistic regression for feature selection to cut through the noise before training an XGBoost model, and handled batch effects and class imbalance as part of the pipeline.
The biggest challenge was the time constraint. We had to make fast decisions about which techniques to prioritize and when to stop tuning. I learned a lot about scoping down a problem quickly and trusting the process even when early results looked messy. We ended up hitting 82% accuracy and 93% AUC, which I was really proud of given the complexity of the data and the timeline.

What stuck with me most was how much the CS and biology intersection opened up. You could see real diagnostic potential in the approach, and that made the technical work feel meaningful beyond just the competition.",Umasuthan,,,Dhivya,"1. What is a random topic you could ramble on and on about?
Socioeconomic inequality. I could genuinely talk about this forever. What gets me is how much of where you end up in life is determined before you ever make a single choice. The neighbourhood you grow up in shapes the schools you attend, which shapes the opportunities you can access, which shapes your income, which shapes the neighbourhood your kids grow up in. The cycle is so well documented and yet somehow still treated like a series of individual failures rather than a structural pattern.

I find the data side of it particularly fascinating. Things like the relationship between zip code and life expectancy, or how upward mobility rates in the US have been declining for decades while the narrative of meritocracy has somehow gotten louder. There is research showing that a child born into the bottom income quintile in Canada has roughly a 1 in 3 chance of making it to the top two quintiles, and people will debate endlessly about whether that number reflects effort or circumstance, when the more interesting question is why the number looks so different depending on your postal code.

And that number does not hit everyone the same way. When you layer in race, gender, immigration status, or disability, the picture gets a lot more complicated and a lot more honest. A first generation immigrant woman of colour is not just navigating one system that was not built for her, she is navigating several at once, and the compounding effect of that is something aggregate statistics tend to flatten out completely.

I also think about how technology intersects with all of this, which is probably why it follows me into my work. AI and automation have real potential to widen those gaps if the people building the tools are not thinking carefully about who benefits and who gets left out.",Western,"The ideal time looks like landing on an idea I actually care about and spending the first few hours doing what most people skip: actually scoping it. Mapping out what we are building, what the MVP looks like, how we are splitting the work, and what we are cutting if time runs out. I want to go into the build with a real plan, not just vibes and a GitHub repo.

From there I want to watch that plan turn into something real. Picking the stack deliberately, moving fast but not recklessly, and checking in as a team as things shift. There is a version of a hackathon where everyone is heads down on their own piece and nobody talks until the demo. That is not what I am looking for. I want the kind of collaboration where we are constantly pulling each other forward.

What makes that even better is being surrounded by people who have that same fire for their own ideas. Seeing someone else light up when they talk about what they are building out of a room is one of the most motivating things I know. That energy is contagious and it makes you push harder on your own work just from being around it.

More than anything I want SummerHacks to feel like the kind of environment where you genuinely believe you can pull off something ambitious in a weekend. Where the outdoor setting strips away the noise, the timeline feels tight but not impossible, and the people around you make the whole thing feel like more than a competition.

I would leave feeling like I built something I am proud of, executed on a real plan, and came away with at least one idea still worth chasing.",N/A,"Vegetarian (no egg, no fish, no meat)",Yes,,,,,
895ec1c9-9730-4c93-8114-1f4081d505ac,m398kim@uwaterloo.ca,2026-06-11 04:21:36.414778+00,pending,,,19,Male,https://github.com/MatthewKim07,https://www.linkedin.com/in/matthew-min-kim/,Asian,https://drive.google.com/file/d/1DSkuGU3aaA8AXNI9ys9UX8XbF9NQ5AEU/view?usp=sharing,M,First,"A project that I’m proud of is building the Assignment Planner web app for the University of Waterloo: https://assignment-planner.lib.uwaterloo.ca/. I built it during my first co-op at the University of Waterloo Libraries. The original tool was previously tied to an outdated Drupal CMS system, so I rebuilt it independently from scratch, turning it into a standalone application that could be more easily maintained and used by real students.

My role was end-to-end, covering the frontend, backend, accessibility improvements, testing, Docker setup, and CI/CD deployments through GitHub Actions. This was my first time using Docker and GitHub Actions to deploy a real application to development and production servers, so it was really rewarding to see my work live on a real UWaterloo website.

One challenge I faced was making sure the new version matched the original planner’s logic while also improving the UI/UX, accessibility, and overall structure and maintainability of the code.

This project taught me how to build software for real users with different needs, instead of just building something that works or looks good on the surface.",Kim,https://matthewkim.ca/,,Matthew,"A random topic I could ramble on about is travelling. I love exploring new places, but not just the famous spots everyone goes to. Some of the best parts of travelling are the random hidden spots, quiet streets, unexpected views, and small interactions with strangers and locals that end up becoming the most memorable parts of the trip.

I like talking about the places I’ve been, the stories behind them, and the random moments that made each trip feel unique and add to my “dad lore.” Travelling also makes me more curious about people, culture, food, and how different everyday life is depending on where you are.",University of Waterloo,"An ideal time at SummerHacks would be meeting new people, reconnecting with people I already know, enjoying the beautiful summer weather, and building a cool project that I probably would not have made on my own. I enjoy hackathons because they push me to move quickly, try new ideas, and learn from the people around me.

By the end of the event, I’d love to leave with a fun and useful project, new friends, and some random memories from a great weekend.",No,N/A,Yes,,,,,
897f8769-c1c1-4f34-a706-d3f6052e7fc1,muhammadbalawalsafdar@gmail.com,2026-06-12 14:19:52.188041+00,pending,,,20,Male,https://github.com/muhammadbalawal,https://www.linkedin.com/in/muhammadbalawal/,Asian,https://www.balawalsafdar.com/CV.pdf,M,First,"A few months ago I cold-emailed Kim Knight, one of the most well-known Cisco Packet Tracer developers in the community, just hoping she'd point me in the right direction. That email turned into cisco-pt-mcp, an open-source MCP server that lets AI clients like Claude, Cursor, and VS Code actually control a running Packet Tracer instance.

I built everything: the extension that runs inside Packet Tracer, the Python MCP server, the PyPI package, the docs. The hardest part was wrestling with Packet Tracer's scripting environment. It's a legacy system that was never designed for this. A lot of what I needed wasn't in any docs. I just had to figure it out.

What I learned is that shipping something real is a completely different problem than getting it to work. Making it installable in five minutes for someone who isn't me took almost as long as building the thing itself. I also learned that building for systems people already use, even old ones that everyone's written off, is often more impactful than chasing whatever's trending. Millions of students still use Packet Tracer. Nobody was building for them. That gap was worth filling.",Safdar,https://www.balawalsafdar.com,,Muhammad Balawal,"I think creativity used to be partially defined by friction. Learning to draw, code, write — the barrier was real. A lot of ideas never made it into the world because the person who had them couldn't get past the technical part. AI is dissolving that barrier, and I think that's mostly good.

It doesn't make human art less valuable. What it does is shift where the value lives. If anyone can generate something visually stunning with a prompt, then what becomes interesting is the why. The intent, the perspective, the question that started it. That part is still human.

I see this in my own work. cisco-pt-mcp wouldn't exist in its current form without AI helping me work through edge cases and documentation at 2am. But the original idea, what if an AI client could just control Packet Tracer directly, came from me noticing a gap nobody else was filling. The creativity was in the question, not the execution.

AI gives more people the ability to realize ideas they've always had. That's not a threat to human creativity. That's just more humans getting to be creative.",Concordia,"I want to build something real with people I wouldn't normally meet. Every project I'm actually proud of came from being in a room with a team, a deadline, and zero time to overthink it. That pressure does something. I'm not here for the resume line. I genuinely love the energy of a hackathon and I want to find people who think the same way I do. Start with a real problem, build toward something that actually works, ship it before the weekend ends.",No,None,Yes,2,"I skate. Longboard mostly, just cruising. It's the one thing that fully shuts my brain off. I also tutor CS students, which started as a side thing and turned into something I actually look forward to. There's a specific satisfaction in watching someone finally get a concept they've been stuck on for days. It's different from shipping code but just as good.

Outside of that I'm pretty social. I like being around people who are excited about things, whatever those things are. You could talk to me about mycology or medieval history for an hour and I'm genuinely in. Curiosity is contagious and I'll take it in any form.","Legacy software that never died. Systems that were technically replaced years ago but still have millions of active users. Cisco Packet Tracer, COBOL running bank transactions, MS-DOS conventions buried in Windows file paths. I find it fascinating why they survived, what communities formed around them, and why building tools for those users is often more impactful than building for whatever just dropped on Product Hunt. Half my best projects came from looking at something everyone wrote off and asking: what would this look like if it were actually good?","Bear with sharks for arms. Easy. The muffin-baby situation is an open-ended social catastrophe with no resolution. Every coffee shop, every family gathering, every time someone hands you something wrapped in a blanket, you're cooked. There's no coming back from that. At least the shark-bear is a defined problem. One bear. One fight. Clear scope. I survive or I don't, but nobody's calling anyone afterward. I'll take the well-scoped problem over the infinite edge case every time. That's just how my brain works.",
89e09738-1368-4b2c-ba9c-10dbd98636bc,gurehmat9@gmail.com,2026-06-19 21:00:11.604835+00,pending,,,19,Male,https://github.com/Gurehmat,https://www.linkedin.com/in/gurehmat/,Prefer not to say,https://gurehmat.dev/index.html#resume,XS,First,"The Record, a live AI debate referee I built solo at ConHacks 2026. Two people debate, the AI listens and tracks credibility in real time, then delivers a verdict out loud via text-to-speech at the end. I did everything myself in 36 hours, the React frontend, the Gemini integration for argument analysis, ElevenLabs for the TTS verdict, all of it. The hardest part was getting the credibility scoring to actually feel coherent across a full debate and not just react to individual lines in isolation. Ended up winning Best Use of ElevenLabs which was a nice payoff for a solo build. Mostly just showed me how much you can ship when you stop second-guessing and just build.",Chahal,https://gurehmat.dev/index.html#home,,Gurehmat,"Many Worlds interpretation of quantum mechanics, and it how it interconnects with philosophy. The actual claim is that every quantum event branches reality into parallel versions of itself, which I already find extremely interesting and crazy but is a legitimate position. What I am even more curious about is what it does to concepts like choice and identity. If every possible version of a decision actually happens somewhere, what does making a decision even mean? Is the version of you in another branch still you? I can genuinely go on about this forever.
",McMaster University,"Finding people whose energy matches early, agreeing on something we actually think is interesting, and then just building. I've been getting into hardware lately and I'd love for that to be part of it, like actually having something physical to show at the end instead of just a web app. Combining that with software in a way that feels intentional would be the dream scenario. Less thinking, more making, good people around, and something real to demo at the end.",N/A,"Peanuts, Treenuts, Bananas, coconuts",Yes,,,,,
8a253c03-fc60-4b94-b633-1ece005440db,arshiyakhayatzadeh2006@gmail.com,2026-06-12 02:56:02.066192+00,pending,,,19,Male,,www.linkedin.com/in/arshiya-khayatzadeh,Middle Eastern / North African,https://drive.google.com/file/d/1akpcTSluVMmmWUTVTIIofWDEL1OZZbqo/view?usp=sharing,M,Second,"One project I'm proud of is openclaw, a SimCity-style multi-agent world simulation built during a hackathon. My role was designing the agent decision loop the core system that determined how autonomous agents processed their environment and chose actions.
The challenge was making agents feel genuinely emergent rather than scripted. Early iterations were hollow and predictable, so I had to rethink how agent state and goals were structured so behaviour felt organic.
The lesson: making something feel alive is a completely different problem from making it work.",Khayatzadeh,https://arshiyak-portfolio.vercel.app,,Arshiya,"Music is one of the fields that I have always been passionate about like not just learning an instrument because I did go and learn piano for 11 years and I was really cracked at it until I came to Canada and havent had  the chance to buy a piano (I am probably really bad right now), but also if you ask me about any genre of music I will give you names, great albums, the history behind how that genre even got created this all happened one night when I was listening to November rain by guns n roses  at 3 a.m. and I was 11 I said to myself this is my life now I have a purpose then I just learned about music more and more got into album production went and learned how albums get created learned about the history and story behind the best selling albums of all time and then I wanted to just learn more instruments so I picked up electric guitar violin saxophone and yeah I live for music, I can not imagine my life without music. ",University of Toronto,"One person that can sell a car to a grandma without a licence, a person who can see the problems of a product or solution from 100kms away, and a person whit god like coding skills who uses AI to manage his outcome and productivity.",nope,none,Yes,,,,,
8be11663-8363-40f7-a659-451563afecc9,tyfifago@gmail.com,2026-06-08 02:27:05.880209+00,pending,,,21,Male,https://github.com/TCrawley11,https://www.linkedin.com/in/tygo-crawley-034b1a271/,Mixed / Multiple,https://drive.google.com/file/d/1TxejzsaBZuxqrXvK3PnLkDNnEd2TWQQb/view?usp=sharing,M,Fourth,"A project that I'm proud of is the AI Vending Machine my team and I built for BearHacks and won 2nd place. For me, winning 2nd place was only the bonus, and the things that I learnt and challenges my team faced while building is what makes me proud of the project. To start off, it was quite the ambitious project. I mean none of us were experts at hardware, and we were only a team of 3, with one of us needing to leave a day early. I decided to setup the LLM routing, agent infrastructure (tools, vision api, voice api), and personally vowed that I would make the cheap servo, which was the only thing we had, work for our demo. 

The biggest challenge was the time constraints. The thing with hardware projects is that time is arguably orders of magnitude more important than pure software projects. We weren't able to really flesh out ideas as much as we would've liked to, which led to a fragile hardware setup. But, it lasted through the demo, and overall really showcased what we were going for. This taught me that a unique idea + tangible effort wins over a boring + well-tested idea, at least in hackathons! The experience encouraged me to experiment more and truly have fun with the process of building, not just thinking about the end product.",Crawley,,,Tygo,"I would define creativity today as an individual's unique taste based on their experiences, personality, and everything else they've lived through. It's unique from person to person, and embodies that person's core beliefs. I think this is why certain work speaks to some people more than others and why we feel like we see ourselves in fictional characters or even real-life people. 

With generative AI, many may argue that the value put on creativity has greatly diminished. I am on the side that argues opposite to this; If anything I think generative AI enhances human creativity. The reason I argue this is because generative AI is math, and math has one right answer. Now obviously generative AI is not deterministic, but outputs have a set range. Meanwhile humans have unlimited range in which we can discover and explore what creativity means to us. Not only does generative AI enable everybody to do things that would take massive time investments to learn, but it also highlights the truly creative and innovative people more due to an overwhelming amount of the same 'slop' being produced.   ",Western University,"I hope to learn a ton, make a project that others and myself will remembers, and grow my network in a genuine way and not the transactional way. SummerHacks being outdoors is also so cool, and I hope to do the impossible task of being locked in but touching grass at the same time. ",No,Peanuts,Yes,,"Offline I love hanging out with the people that I love, like my family and friends. Being able to spend time with them is something that I take for granted everyday. Other than that, I love games and movies, especially international films since I get to see a whole different side of the world culturally.","I could ramble on and on about the Wii and all its games. I used to play on that beautiful console every day when I was younger, and have endless praise that totally needs to be heard by everybody. After I got older and became a programmer, it only grew my love for the console because now I can appreciate the work that went in to that work of art. ","This depends... If all babies looked like muffins, then definitely the first one since I wouldn't be able to see all those cute babies. If muffins also looked like babies, then I would take that one. I wouldn't mind never eating a muffin again and I still get to babies. A beat with sharks as arms would be fine since I would just run around while waiting for the sharks to die since they're on land. ",
